{
    "$schema": "urn:pickle:schemas:artefacts:domains:application:logical:APP-CAP-DAP",
    "audience": [
        "Enterprise Architect",
        "Application Architect",
        "Chief Information Officer"
    ],
    "author": [
        "Application Architect",
        "Systems Analyst"
    ],
    "relationships": [
        {
            "column-id": "CAP-001-01",
            "row-id": "PLAT-CRM"
        },
        {
            "column-id": "CAP-001-02",
            "row-id": "PLAT-CRM"
        },
        {
            "column-id": "CAP-001-02",
            "row-id": "PLAT-DXP"
        },
        {
            "column-id": "CAP-001-04",
            "row-id": "PLAT-DXP"
        },
        {
            "column-id": "CAP-001-02",
            "row-id": "PLAT-MOBILE-APP"
        },
        {
            "column-id": "CAP-001-02",
            "row-id": "PLAT-CONTACT-CENTRE"
        },
        {
            "column-id": "CAP-001-01",
            "row-id": "PLAT-MARKETING-AUTOMATION"
        },
        {
            "column-id": "CAP-001-04",
            "row-id": "PLAT-MARKETING-AUTOMATION"
        },
        {
            "column-id": "CAP-005-03",
            "row-id": "PLAT-EAM"
        },
        {
            "column-id": "CAP-005-04",
            "row-id": "PLAT-EAM"
        },
        {
            "column-id": "CAP-005-04",
            "row-id": "PLAT-FSM"
        },
        {
            "column-id": "CAP-004-04",
            "row-id": "PLAT-FSM"
        },
        {
            "column-id": "CAP-005-03",
            "row-id": "PLAT-IOT"
        },
        {
            "column-id": "CAP-003-02",
            "row-id": "PLAT-ETRM"
        },
        {
            "column-id": "CAP-003-04",
            "row-id": "PLAT-ETRM"
        },
        {
            "column-id": "CAP-003-01",
            "row-id": "PLAT-MARKET-DATA"
        },
        {
            "column-id": "CAP-003-03",
            "row-id": "PLAT-RISK-ANALYTICS"
        },
        {
            "column-id": "CAP-004-02",
            "row-id": "PLAT-ADMS"
        },
        {
            "column-id": "CAP-004-02",
            "row-id": "PLAT-EMS"
        },
        {
            "column-id": "CAP-004-04",
            "row-id": "PLAT-OMS"
        },
        {
            "column-id": "CAP-004-03",
            "row-id": "PLAT-GIS"
        },
        {
            "column-id": "CAP-005-01",
            "row-id": "PLAT-GIS"
        },
        {
            "column-id": "CAP-006-03",
            "row-id": "PLAT-CIS"
        },
        {
            "column-id": "CAP-006-04",
            "row-id": "PLAT-CIS"
        },
        {
            "column-id": "CAP-006-01",
            "row-id": "PLAT-TARIFF-ENGINE"
        },
        {
            "column-id": "CAP-006-02",
            "row-id": "PLAT-MDM"
        },
        {
            "column-id": "CAP-006-02",
            "row-id": "PLAT-HES"
        },
        {
            "column-id": "CAP-007-02",
            "row-id": "PLAT-REG-REPORTING"
        },
        {
            "column-id": "CAP-008-01",
            "row-id": "PLAT-EMISSIONS"
        },
        {
            "column-id": "CAP-008-04",
            "row-id": "PLAT-ESG"
        },
        {
            "column-id": "CAP-001-03",
            "row-id": "PLAT-DATA-LAKEHOUSE"
        },
        {
            "column-id": "CAP-009-03",
            "row-id": "PLAT-MDM-MASTER"
        },
        {
            "column-id": "CAP-001-03",
            "row-id": "PLAT-BI"
        },
        {
            "column-id": "CAP-003-01",
            "row-id": "PLAT-ML"
        },
        {
            "column-id": "CAP-009-01",
            "row-id": "PLAT-ERP"
        },
        {
            "column-id": "CAP-009-04",
            "row-id": "PLAT-ERP"
        },
        {
            "column-id": "CAP-009-02",
            "row-id": "PLAT-HRIS"
        },
        {
            "column-id": "CAP-009-03",
            "row-id": "PLAT-ITSM"
        },
        {
            "column-id": "CAP-009-03",
            "row-id": "PLAT-COLLAB"
        },
        {
            "column-id": "CAP-009-03",
            "row-id": "PLAT-API-GATEWAY"
        },
        {
            "column-id": "CAP-009-03",
            "row-id": "PLAT-EVENT-BROKER"
        },
        {
            "column-id": "CAP-009-03",
            "row-id": "PLAT-IPAAS"
        }
    ],
    "activity": [
        {
            "timestamp": "2026-01-15T09:30:00Z",
            "action": "Created",
            "who": "Joe B",
            "notes": "Initial baseline for version 1.0.0."
        },
        {
            "timestamp": "2026-03-04T14:10:00Z",
            "action": "Updated",
            "who": "Joe B",
            "notes": "Reviewed and refined during the 2026-Q1 architecture cycle."
        }
    ]
}
