{
    "$schema": "urn:pickle:schemas:artefacts:domains:application:physical:APP-PRN-GRD",
    "audience": [
        "Enterprise Architect",
        "Application Architect",
        "Chief Information Officer"
    ],
    "author": [
        "Application Architect",
        "Systems Analyst"
    ],
    "relationships": [],
    "activity": [
        {
            "timestamp": "2026-01-15T09:30:00Z",
            "action": "Created",
            "who": "Joe Bloggs",
            "notes": "Initial baseline for version 1.0.0."
        },
        {
            "timestamp": "2026-03-04T14:10:00Z",
            "action": "Updated",
            "who": "Joe Bloggs",
            "notes": "Reviewed and refined during the 2026-Q1 architecture cycle."
        }
    ]
}
